id,title,vote_average,vote_count,revenue,runtime,imdb_id,original_language,overview,popularity,genres,spoken_languages,keywords
277834,Moana,7.6,11502,690860472,107,tt3521164,en,"In Ancient Polynesia, when a terrible curse incurred by Maui reaches an impetuous Chieftain's daughter's island, she answers the Ocean's call to seek out the demigod to set things right.",17.963,"Adventure, Comedy, Family, Animation",English,"sailboat, sea, island, saving the world, ocean, cartoon, mythology, musical, curse, sailor, aftercreditsstinger, demigod, polynesia, voyage, pacific  ocean, quest, island life, animal sidekick"
399055,The Shape of Water,7.247,11490,195333312,123,tt5580390,en,"An other-worldly story, set against the backdrop of Cold War era America circa 1962, where a mute janitor working at a lab falls in love with an amphibious man being held captive there and devises a plan to help him escape.",29.339,"Drama, Fantasy, Romance","English, Russian","government, fairy tale, cold war, supernatural, baltimore, usa, laboratory, orphan, bathtub, scientist, magic realism, capture, sign languages, 1960s, fishman, amphibious creature"
85,Raiders of the Lost Ark,7.924,11483,389925971,115,tt0082971,en,"When Dr. Indiana Jones – the tweed-suited professor who just happens to be a celebrated archaeologist – is hired by the government to locate the legendary Ark of the Covenant, he finds himself up against the entire Nazi regime.",60.763,"Adventure, Action","English, Spanish, German, Hebrew, Arabic, Nepali","egypt, treasure, medallion, swastika, saving the world, nepal, himalaya mountain range, cairo, moses, hat, whip, leather jacket, mediterranean, ark of the covenant, ten commandments, nazi, excavation, riddle, treasure hunt, archaeologist, adventurer, archeology, religious history, 1930s"
19908,Zombieland,7.3,11466,102391540,88,tt1156398,en,"Columbus has made a habit of running from what scares him. Tallahassee doesn't have fears. If he did, he'd kick their ever-living ass. In a world overrun by zombies, these two are perfectly evolved survivors. But now, they're about to stare down the most terrifying prospect of all: each other.",32.08,"Comedy, Horror",English,"washington dc, usa, sibling relationship, circus, post-apocalyptic future, blood splatter, gore, parody, road trip, zombie, survival horror, amusement park, twinkie, body count, zombification, disposing of a dead body, loner, aftercreditsstinger, zombie apocalypse, fear of clowns, actor playing themself"
127380,Finding Dory,7.042,11429,1028570889,97,tt2277860,en,Dory is reunited with her friends Nemo and Marlin in the search for answers about her past. What can she remember? Who are her parents? And where did she learn to speak Whale?,26.562,"Adventure, Animation, Comedy, Family",English,"fish, amnesia, octopus, sequel, anthropomorphism, underwater, aftercreditsstinger, clownfish"
296096,Me Before You,7.918,11414,207945075,110,tt2674426,en,"A small town girl is caught between dead-end jobs. A high-profile, successful man becomes wheelchair bound following an accident. The man decides his life is not worth living until the girl is hired for six months to be his new caretaker. Worlds apart and trapped together by circumstance, the two get off to a rocky start. But the girl becomes determined to prove to the man that life is worth living and as they embark on a series of adventures together, each finds their world changing in ways neither of them could begin to imagine.",79.741,"Drama, Romance",English,"depression, small town, based on novel or book, england, artist, wheelchair, romance, love, caretaker, caregiver, disabled, valentine's day, twenty something, woman director, accident"
530915,1917,7.99,11395,394638258,119,tt8579674,en,"At the height of the First World War, two young British soldiers must cross enemy territory and deliver a message that will stop a deadly attack on hundreds of soldiers.",44.356,"War, History, Thriller","English, French, German","race against time, world war i, british army, soldier, trenches, 1910s, trench warfare, no man's land"
398818,Call Me by Your Name,8.167,11367,43143046,132,tt5726616,en,"In 1980s Italy, a relationship begins between seventeen-year-old teenage Elio and the older adult man hired as his father's research assistant.",32.15,"Romance, Drama","French, English, Italian","based on novel or book, upper class, italy, swimming pool, coming of age, love, breaking the fourth wall, summer, teenage boy, masturbation, first love, lgbt, jewish family, 1980s, peach, gay theme"
82693,Silver Linings Playbook,7.13,11327,236412453,122,tt1045658,en,"After spending eight months in a mental institution, a former teacher moves back in with his parents and tries to reconcile with his ex-wife.",28.014,"Drama, Comedy, Romance",English,"depression, infidelity, dancing, friendship, philadelphia, pennsylvania, based on novel or book, widow, letter, neighbor, mental illness, ex-wife, institutionalization, death of husband, bipolar, restraining order, father son relationship, male mental health"
809,Shrek 2,7.249,11323,928760770,93,tt0298148,en,"Shrek, Fiona and Donkey set off to Far, Far Away to meet Fiona's mother and father. But not everyone is happy. Shrek and the King find it hard to get along, and there's tension in the marriage. The fairy godmother discovers that Shrek has married Fiona instead of her Son Prince Charming and sets about destroying their marriage.",82.153,"Animation, Family, Comedy, Fantasy, Adventure",English,"prison, princess, magic, kingdom, fairy tale, liberation, transformation, honeymoon, prince, parents-in-law, enchantment, sequel, anthropomorphism, dragon, ogre, cartoon donkey, shrek cinematic universe"
14161,2012,5.819,11300,791217826,158,tt1190080,en,"Dr. Adrian Helmsley, part of a worldwide geophysical team investigating the effect on the earth of radiation from unprecedented solar storms, learns that the earth's core is heating up. He warns U.S. President Thomas Wilson that the crust of the earth is becoming unstable and that without proper preparations for saving a fraction of the world's population, the entire race is doomed. Meanwhile, writer Jackson Curtis stumbles on the same information. While the world's leaders race to build ""arks"" to escape the impending cataclysm, Curtis struggles to find a way to save his family. Meanwhile, volcanic eruptions and earthquakes of unprecedented strength wreak havoc around the world.",51.914,"Action, Adventure, Science Fiction","Tibetan, German, Russian, French, Mandarin, Latin, Portuguese, Spanish, Italian, Hindi, English","race against time, maya civilization, civilization, natural disaster, earthquake, end of the world, disaster, apocalypse, destruction, volcanic eruption, flood, disaster movie, ark, solar, anxious, 2010s, cautionary, dramatic"
240,The Godfather Part II,8.591,11293,102600000,202,tt0071562,en,"In the continuing saga of the Corleone crime family, a young Vito Corleone grows up in Sicily and in 1910s New York. In the 1950s, Michael Corleone attempts to expand the family business into Las Vegas, Hollywood and Cuba.",64.753,"Drama, Crime","English, Italian, Latin, Spanish","italian american, cuba, italy, gangster, praise, symbolism, melancholy, revenge, organized crime, mafia, lawyer, suburb, corrupt politician"
14,American Beauty,8.0,11260,356296601,122,tt0169547,en,"Lester Burnham, a depressed suburban father in a mid-life crisis, decides to turn his hectic life around after developing an infatuation with his daughter's attractive friend.",29.837,Drama,English,"estate agent, adultery, coming out, first time, virgin, cheating, parent child relationship, age difference, midlife crisis, cheerleader, dark comedy, rose, satire, dysfunctional family, suburbia, coming of age, sexual fantasy, dysfunctional marriage, marijuana, loneliness, love affair, exercise, extramarital affair, realtor, quitting a job, voyeur, neighborhood, retired army man, closeted homosexual, singing in a car, gay theme, teenager, camcorder"
70981,Prometheus,6.535,11255,403354469,124,tt1446714,en,"A team of explorers discover a clue to the origins of mankind on Earth, leading them on a journey to the darkest corners of the universe. There, they must fight a terrifying battle to save the future of the human race.",60.299,"Science Fiction, Adventure, Mystery","Gaelic, English","android, alien, space, creature, spin off, creation, emergency surgery, stasis, archeological dig, god complex, cave drawing, prometheus, genetic mutation, origins of life, 2090s"
37799,The Social Network,7.358,11190,224920315,121,tt1285016,en,"The tale of a new breed of cultural insurgent: a punk genius who sparked a revolution and changed the face of human interaction for a generation, and perhaps forever.",36.101,Drama,English,"hacker, based on novel or book, boston, massachusetts, ex-girlfriend, harvard university, narcissism, based on true story, hacking, historical fiction, twins, double cross, misogyny, creator, frat party, social network, deposition, intellectual property, entrepreneur, arrogance, social media, young entrepreneur, facebook, legal drama, boat racing"
166426,Pirates of the Caribbean: Dead Men Tell No Tales,6.648,11176,795922298,128,tt1790809,en,"Thrust into an all-new adventure, a down-on-his-luck Capt. Jack Sparrow feels the winds of ill-fortune blowing even more strongly when deadly ghost sailors led by his old nemesis, the evil Capt. Salazar, escape from the Devil's Triangle. Jack's only hope of survival lies in seeking out the legendary Trident of Poseidon, but to find it, he must forge an uneasy alliance with a brilliant and beautiful astronomer and a headstrong young man in the British navy.",62.006,"Adventure, Action, Fantasy",English,"sea, ship, treasure map, sequel, artifact, pirate, period drama, monkey, swashbuckler, ghost, caribbean sea, trident"
546554,Knives Out,7.847,11156,312897920,131,tt8946378,en,"When renowned crime novelist Harlan Thrombey is found dead at his estate just after his 85th birthday, the inquisitive and debonair Detective Benoit Blanc is mysteriously enlisted to investigate. From Harlan's dysfunctional family to his devoted staff, Blanc sifts through a web of red herrings and self-serving lies to uncover the truth behind Harlan's untimely death.",39.064,"Comedy, Crime, Mystery","Spanish, English","immigrant, detective, massachusetts, investigation, big family, mansion, whodunit, family home, murder mystery, neo-noir, privilege"
489,Good Will Hunting,8.149,11111,225933435,127,tt0119217,en,"Will Hunting has a genius-level IQ but chooses to work as a janitor at MIT. When he solves a difficult graduate-level math problem, his talents are discovered by Professor Gerald Lambeau, who decides to help the misguided youth reach his potential. When Will is arrested for attacking a police officer, Professor Lambeau makes a deal to get leniency for him if he will get treatment from therapist Sean Maguire.",56.169,Drama,English,"boston, massachusetts, professor, baseball, mathematics, genius, harvard university, male friendship, ambition, flashback, love, friends, psychologist, janitor, university, courtroom, prodigy, math genius"
216015,Fifty Shades of Grey,5.882,11101,571006128,125,tt2322441,en,"When college senior Anastasia Steele steps in for her sick roommate to interview prominent businessman Christian Grey for their campus paper, little does she realize the path her life will take. Christian, as enigmatic as he is rich and powerful, finds himself strangely drawn to Ana, and she to him. Though sexually inexperienced, Ana plunges headlong into an affair -- and learns that Christian's true sexual proclivities push the boundaries of pain and pleasure.",96.283,"Drama, Romance, Thriller",English,"bad smell, based on novel or book, eroticism, perversion, spanking, billionaire, rich, bdsm, woman director"
350,The Devil Wears Prada,7.384,11089,326706115,109,tt0458352,en,"Andy moves to New York to work in the fashion industry. Her boss is extremely demanding, cruel and won't let her succeed if she doesn't fit into the high class elegant look of their magazine.",50.84,"Comedy, Drama, Romance","English, French","new york city, journalist, paris, france, based on novel or book, journalism, fashion journal, assistant, job entrant, job interview, editor-in-chief, fashion, fashion magazine, bullied, city life, fashion industry"
103,Taxi Driver,8.2,11081,28600000,114,tt0075314,en,A mentally unstable Vietnam War veteran works as a night-time taxi driver in New York City where the perceived decadence and sleaze feed his urge for violent action.,41.36,"Crime, Drama","English, Spanish","drug dealer, vietnam veteran, new york city, taxi, pornography, obsession, taxi driver, pimp, firearm, politician, alienation, junk food, misanthrophy, vigilante, illegal prostitution, character study, loner, manhattan, new york city, neo-noir, child prostitution, new hollywood, drives"
332562,A Star Is Born,7.503,11079,433888866,136,tt1517451,en,"Seasoned musician Jackson Maine discovers — and falls in love with — struggling artist Ally. She has just about given up on her dream to make it big as a singer — until Jack coaxes her into the spotlight. But even as Ally's career takes off, the personal side of their relationship is breaking down, as Jack fights an ongoing battle with his own internal demons.",27.891,"Music, Drama, Romance",English,"concert, country music, waitress, pop star, self-destruction, talent, addiction, death of father, alcoholism, remake, aspiring singer, singer, fame, tinnitus, falling in love, insecurity, alcoholic, death of mother, aspiration, death of parent, showbiz, emotional vulnerability, hearing impaired, brother brother relationship"
228150,Fury,7.518,11021,211817906,135,tt2713180,en,"In the last months of World War II, as the Allies make their final push in the European theatre, a battle-hardened U.S. Army sergeant named 'Wardaddy' commands a Sherman tank called 'Fury' and its five-man crew on a deadly mission behind enemy lines. Outnumbered and outgunned, Wardaddy and his men face overwhelming odds in their heroic attempts to strike at the heart of Nazi Germany.",90.378,"War, Drama, Action","English, German, Spanish","hero, nazi, ambush, bravery, world war ii, heroism, tank, europe, execution, battle, brutality, hatred, tank battle, 1940s, enclosed space, beating the odds, european theatre, tanks"
1724,The Incredible Hulk,6.204,11006,163712074,114,tt0800080,en,"Scientist Bruce Banner scours the planet for an antidote to the unbridled force of rage within him: the Hulk. But when the military masterminds who dream of exploiting his powers force him back to civilization, he finds himself coming face to face with a new, deadly foe.",52.734,"Science Fiction, Action, Adventure","Portuguese, Spanish, English","new york city, rio de janeiro, superhero, based on comic, fugitive, on the run, super soldier, scientist, virginia, military, super villain, marvel cinematic universe (mcu), angry, radical transformation, good versus evil"
23483,Kick-Ass,7.12,10997,96188903,117,tt1250777,en,"Dave Lizewski is an unnoticed high school student and comic book fan who one day decides to become a super-hero, even though he has no powers, training or meaningful reason to do so.",38.557,"Action, Crime",English,"hero, secret identity, crime fighter, superhero, dark comedy, comic book, based on comic, murder, mafia, family, realism, mist, adventurer, rookie, young heroes, young adult, criminal heroes, unlikely heroes, heroes, pretending to be gay"
2048,"I, Robot",6.939,10972,347234916,115,tt0343818,en,"In 2035, where robots are commonplace and abide by the three laws of robotics, a technophobic cop investigates an apparent suicide. Suspecting that a robot may be responsible for the death, his investigation leads him to believe that humanity may be in danger.",27.677,"Action, Science Fiction",English,"chicago, illinois, future, man vs machine, hero, artificial intelligence (a.i.), based on novel or book, grandparent grandchild relationship, homicide, detective, dystopia, hologram, murder, robot as menace, car accident, robot, grandmother, robotics, humanoid robot, talking robot, self-driving car, homicide investigation, 2030s, robot companion, old robot, new robot"
6977,No Country for Old Men,7.933,10964,171627166,122,tt0477348,en,"Llewelyn Moss stumbles upon dead bodies, $2 million and a hoard of heroin in a Texas desert, but methodical killer Anton Chigurh comes looking for it, with local sheriff Ed Tom Bell hot on his trail. The roles of prey and predator blur as the violent pursuit of money and justice collide.",33.115,"Crime, Drama, Thriller","English, Spanish","vietnam veteran, sheriff, trailer park, based on novel or book, hitman, psychopath, drug trafficking, texas, motel, usa–mexico border, drug cartel, fate, desert, modern-day western, neo-western, tracking device, cold blooded killer, motel room, cartel, neo-noir, 1980s, mexican cartel, anxious, drug deal, coin toss, human nature, captive bolt gun, western noir, horror western, faithful adaptation, intense"
61791,Rise of the Planet of the Apes,7.289,10799,482860185,105,tt1318514,en,"A highly intelligent chimpanzee named Caesar has been living a peaceful suburban life ever since he was born. But when he gets taken to a cruel primate facility, Caesar decides to revolt against those who have harmed him.",38.032,"Thriller, Action, Drama, Science Fiction",English,"intelligence, dystopia, zoo, alzheimer's disease, cage, golden gate bridge, ape, monkey, medical research"
161,Ocean's Eleven,7.43,10774,450717150,116,tt0240772,en,"Less than 24 hours into his parole, charismatic thief Danny Ocean is already rolling out his next plan: In one night, Danny's hand-picked crew of specialists will attempt to steal more than $150 million from three Las Vegas casinos. But to score the cash, Danny risks his chances of reconciling with ex-wife, Tess.",39.17,"Thriller, Crime","Italian, English","prison, casino, pickpocket, strip club, heist, con artist, thief, caper, atlantic city, salt lake city, utah, las vegas, card dealer, explosives expert"
745,The Sixth Sense,7.944,10754,672806292,107,tt0167404,en,"Following an unexpected tragedy, child psychologist Malcolm Crowe meets a nine year old boy named Cole Sear, who is hiding a dark secret.",32.836,"Mystery, Thriller, Drama","Latin, Spanish, English","dying and death, child abuse, philadelphia, pennsylvania, sense of guilt, afterlife, marriage crisis, loss of loved one, confidence, psychology, paranormal phenomena, single, psychological thriller, cowardliness, single mother, school play, ghost, child, spiritism, ghost child"
194,Amélie,7.905,10750,173921954,122,tt0211915,fr,"At a tiny Parisian café, the adorable yet painfully shy Amélie accidentally discovers a gift for helping others. Soon Amelie is spending her days as a matchmaker, guardian angel, and all-around do-gooder. But when she bumps into a handsome stranger, will she find the courage to become the star of her very own love story?",42.494,"Comedy, Romance","French, Russian","daughter, paris, france, love triangle, photography, ghost train, sex shop, shyness, journey around the world, postcard, romantic comedy, hypochondriac, romance, cafe, kindness, magic realism, child's point of view, montmartre, paris, neighbor neighbor relationship, father daughter relationship, happy ending, childhood memory, euphoric"
111,Scarface,8.168,10749,66023329,169,tt0086250,en,"After getting a green card in exchange for assassinating a Cuban government official, Tony Montana stakes a claim on the drug trade in Miami. Viciously murdering anyone who stands in his way, Tony eventually becomes the biggest drug lord in the state, controlling nearly all the cocaine that comes through Miami. But increased pressure from the police, wars with Colombian drug cartels and his own drug-fueled paranoia serve to fuel the flames of his eventual downfall.",54.199,"Action, Crime, Drama","English, Spanish","corruption, sibling relationship, miami, florida, cuba, loss of loved one, gangster, cocaine, rise and fall, remake, drug cartel, mafia, drug lord, bitterness, rise to power, miami beach, cuban refugees, drug war, inflammatory"
146233,Prisoners,8.091,10748,122126687,153,tt1392214,en,"Keller Dover faces a parent's worst nightmare when his 6-year-old daughter, Anna, and her friend go missing. The only lead is an old motorhome that had been parked on their street. The head of the investigation, Detective Loki, arrests the driver, but a lack of evidence forces Loki to release his only suspect. Dover, knowing that his daughter's life is at stake, decides that he has no choice but to take matters into his own hands.",35.085,"Drama, Thriller, Crime",English,"pennsylvania, usa, kidnapping, hostage, detective, maze, symbolism, investigation, georgia, beating, revenge, vigilante, rural area, crime scene, brutality, candlelight vigil, animal cruelty, neo-noir, sex offender, child abduction"
73,American History X,8.352,10729,23875127,119,tt0120586,en,"Derek Vineyard is paroled after serving 3 years in prison for killing two African-American men. Through his brother, Danny Vineyard's narration, we learn that before going to prison, Derek was a skinhead and the leader of a violent white supremacist gang that committed acts of racial crime throughout L.A. and his actions greatly influenced Danny. Reformed and fresh out of prison, Derek severs contact with the gang and becomes determined to keep Danny from going down the same violent path as he did.",36.427,Drama,English,"prison, neo-nazism, rape, skinhead, sibling relationship, swastika, brother, fascism, jail, school, los angeles, california, family, xenophobia, interracial friendship, nazism"
138843,The Conjuring,7.541,10683,320406242,112,tt1457767,en,"Paranormal investigators Ed and Lorraine Warren work to help a family terrorized by a dark presence in their farmhouse. Forced to confront a powerful entity, the Warrens find themselves caught in the most terrifying case of their lives.",105.394,"Horror, Thriller",English,"sibling relationship, 1970s, cellar, exorcism, haunted house, possession, satanism, rhode island, based on true story, paranormal investigation, crucifix, ghost, shocking, demonic, demonology, psychic vision, the conjuring universe"
222935,The Fault in Our Stars,7.598,10655,307166834,126,tt2582846,en,"Despite the tumor-shrinking medical miracle that has bought her a few years, Hazel has never been anything but terminal, her final chapter inscribed upon diagnosis. But when a patient named Augustus Waters suddenly appears at Cancer Kid Support Group, Hazel's story is about to be completely rewritten.",30.209,"Romance, Drama",English,"based on novel or book, support group, amsterdam, netherlands, cancer, valentine's day, star crossed lovers, teen drama, oxygen tank, based on young adult novel"
11036,The Notebook,7.88,10629,115603229,123,tt0332280,en,"An epic love story centered around an older man who reads aloud to a woman with Alzheimer's. From a faded notebook, the old man's words bring to life the story about a couple who is separated by World War II, and is then passionately reunited, seven years later, after they have taken different paths.",55.483,"Romance, Drama",English,"secret love, based on novel or book, love of one's life, fight, poem, river, sadness, class, dementia, tears, candle, mailbox, valentine's day"
76203,12 Years a Slave,7.945,10603,187000000,134,tt2024544,en,"In the pre-Civil War United States, Solomon Northup, a free black man from upstate New York, is abducted and sold into slavery. Facing cruelty as well as unexpected kindnesses Solomon struggles not only to stay alive, but to retain his dignity. In the twelfth year of his unforgettable odyssey, Solomon’s chance meeting with a Canadian abolitionist will forever alter his life.",34.808,"Drama, History",English,"slavery, plantation, based on memoir or autobiography, violin player, physical abuse, black slave, usa history, slave owner, 19th century, sold into slavery, abolitionist, landowner, abuse of power, african american history"
62,2001: A Space Odyssey,8.076,10575,71923560,149,tt0062622,en,"Humanity finds a mysterious object buried beneath the lunar surface and sets off to find its origins with the help of HAL 9000, the world's most advanced super computer.",48.932,"Science Fiction, Mystery, Adventure","English, Russian","man vs machine, moon, jupiter, artificial intelligence (a.i.), based on novel or book, technology, super computer, space travel, space mission, moon base, astronaut, evolution, monolith, space station, space opera, 2000s"
49530,In Time,6.953,10556,173930596,109,tt1637688,en,"In the not-too-distant future the aging gene has been switched off. To avoid overpopulation, time has become the currency and the way people pay for luxuries and necessities. The rich can live forever, while the rest try to negotiate for their immortality. A poor young man who comes into a fortune of time, though too late to help his mother from dying. He ends up on the run from a corrupt police force known as 'time keepers'.",67.242,"Action, Thriller, Science Fiction",English,"future, race against time, immortality, bank, dystopia, time, love, on the run, class differences, cops and robbers , rich vs poor, in time"
