id,title,vote_average,vote_count,revenue,runtime,imdb_id,original_language,overview,popularity,genres,spoken_languages,keywords
76163,The Expendables 2,6.323,6289,314975955,103,tt1764651,en,"Mr. Church reunites the Expendables for what should be an easy paycheck, but when one of their men is murdered on the job, their quest for revenge puts them deep in enemy territory and up against an unexpected threat.",59.833,"Action, Adventure, Thriller",English,"airplane, loss of loved one, airplane crash, beard, wisecrack humor, airport lounge, asian woman"
39514,RED,6.685,6282,199000000,111,tt1245526,en,"After surviving an assault from a squad of hit men, retired CIA black ops agent Frank Moses reassembles his old team for an all-out war. Frank reunites with old Joe, crazy Marvin and wily Victoria to uncover a massive conspiracy that threatens their lives. Only their expert training will allow them to survive a near-impossible mission -- breaking into CIA headquarters.",25.561,"Action, Adventure, Comedy, Crime, Thriller","English, Russian","assassin, cia, undercover agent, kidnapping, assault rifle, retirement, based on comic, shootout, sniper rifle, explosion, retired, female spy, government agent, undercover operation, black ops, first date"
337401,Mulan,6.906,6280,66800000,115,tt4566758,en,"When the Emperor of China issues a decree that one man per family must serve in the Imperial Chinese Army to defend the country from Huns, Hua Mulan, the eldest daughter of an honored warrior, steps in to take the place of her ailing father. She is spirited, determined and quick on her feet. Disguised as a man by the name of Hua Jun, she is tested every step of the way and must harness her innermost strength and embrace her true potential.",43.222,"Adventure, Fantasy, Drama, Action",English,"martial arts, hero, china, fake identity, honor, east asian lead, heroine, based on myths, legends or folklore, live action and animation, chinese girl, live action remake"
527774,Raya and the Last Dragon,7.9,6271,130423032,107,tt5109280,en,"Long ago, in the fantasy world of Kumandra, humans and dragons lived together in harmony. But when an evil force threatened the land, the dragons sacrificed themselves to save humanity. Now, 500 years later, that same evil has returned and it’s up to a lone warrior, Raya, to track down the legendary last dragon to restore the fractured land and its divided people.",53.503,"Animation, Family, Fantasy, Action, Adventure",English,"kung fu, sword, warrior woman, female protagonist, dragon, vietnamese, south asian, warrior"
381283,mother!,7.0,6267,44516999,121,tt5109784,en,"A couple's relationship is tested when uninvited guests arrive at their home, disrupting their tranquil existence.",24.705,"Drama, Thriller, Horror",English,"husband wife relationship, nightmare, nihilism, chaos, pregnancy, bible, house, vandalism, cult, surrealism, writer, nature, death, madness, stranger, chaotic, forbidden fruit, mother nature, uninvited guest"
11224,Cinderella,7.037,6239,263591415,74,tt0042332,en,"Cinderella has faith her dreams of a better life will come true. With help from her loyal mice friends and a wave of her Fairy Godmother's wand, Cinderella's rags are magically turned into a glorious gown and off she goes to the Royal Ball. But when the clock strikes midnight, the spell is broken, leaving a single glass slipper... the only key to the ultimate fairy-tale ending!",85.42,"Family, Fantasy, Animation, Romance",English,"princess, based on novel or book, loss of loved one, mouse, ball, fairy, prince, musical, midnight, love, orphan, family, evil stepmother, stepsister, fairy godmother, cendrillon"
37135,Tarzan,7.402,6238,448191819,88,tt0120855,en,"Tarzan was a small orphan who was raised by an ape named Kala since he was a child. He believed that this was his family, but on an expedition Jane Porter is rescued by Tarzan. He then finds out that he's human. Now Tarzan must make the decision as to which family he should belong to...",72.359,"Family, Adventure, Animation, Drama",English,"baby, africa, gorilla, adoption, feral child, tarzan, nest, anthropomorphism, jungle, camp, orphan"
28178,Hachi: A Dog's Tale,8.006,6235,46749646,93,tt1028532,en,A drama based on the true story of a college professor's bond with the abandoned dog he takes into his home.,34.409,"Drama, Family","English, Japanese","friendship, loyalty, pet, human animal relationship, family relationships, friends, dog, newspaper reporter, family dog, waiting, pets"
68728,Oz the Great and Powerful,5.903,6232,491868548,130,tt1623205,en,"Oscar Diggs, a small-time circus illusionist and con-artist, is whisked from Kansas to the Land of Oz where the inhabitants assume he's the great wizard of prophecy, there to save Oz from the clutches of evil.",29.84,"Fantasy, Adventure, Family",English,"witch, magic, circus, hope, illusion, magic trick, wizard, based on young adult novel"
1091,The Thing,8.045,6232,19629760,109,tt0084787,en,"A team of American scientists investigate the empty, destroyed base of their Norwegian counterparts in Antarctica, only to discover a terrifying life force that can take the form of its prey.",57.921,"Horror, Mystery, Science Fiction","English, Norwegian","spacecraft, space marine, based on novel or book, isolation, mutation, paranoia, snowstorm, research station, alien life-form, alien, remake, creature, helicopter pilot, antarctica, shape shifting alien, alien infection, sled dogs, alien monster, alien parasites, isolated place, uncertainty, body horror, ambiguity"
81188,Rise of the Guardians,7.36,6229,306941670,97,tt1446192,en,"When an evil spirit known as Pitch lays down the gauntlet to take over the world, the immortal Guardians must join forces for the first time to protect the hopes, beliefs and imagination of children all over the world.",36.796,"Family, Animation, Fantasy, Action, Adventure","French, English","new york city, friendship, amnesia, santa claus, cartoon, easter bunny, boogeyman, jack frost, duringcreditsstinger, christmas"
262504,Allegiant,6.1,6228,179246868,120,tt3410834,en,Beatrice Prior and Tobias Eaton venture into the world outside of the fence and are taken into protective custody by a mysterious agency known as the Bureau of Genetic Welfare.,19.857,"Adventure, Science Fiction, Action, Mystery",English,"based on novel or book, revolution, dystopia, sequel, based on young adult novel"
188927,Star Trek Beyond,6.781,6226,343471816,122,tt2660888,en,"The USS Enterprise crew explores the furthest reaches of uncharted space, where they encounter a mysterious new enemy who puts them and everything the Federation stands for to the test.",47.927,"Action, Adventure, Science Fiction",English,"spacecraft, sequel, stranded, hatred, lgbt, space opera, gay theme"
9615,The Fast and the Furious: Tokyo Drift,6.454,6222,158964610,104,tt0463985,en,"In order to avoid a jail sentence, Sean Boswell heads to Tokyo to live with his military father. In a low-rent section of the city, Shaun gets caught up in the underground world of drift racing",11.096,"Action, Crime, Drama, Thriller","English, Japanese","car race, car journey, car mechanic, car garage, auto-tuning, street race, drifting, tokyo, japan"
6957,The 40 Year Old Virgin,6.374,6218,177378645,116,tt0405422,en,"Andy Stitzer has a pleasant life with a nice apartment and a job stamping invoices at an electronics store. But at age 40, there's one thing Andy hasn't done, and it's really bothering his sex-obsessed male co-workers: Andy is still a virgin. Determined to help Andy get laid, the guys make it their mission to de-virginize him. But it all seems hopeless until Andy meets small business owner Trish, a single mom.",22.984,"Comedy, Romance","English, Spanish","first time, virgin, male friendship, co-workers relationship, poker game, sex comedy, virginity, sex"
117263,Olympus Has Fallen,6.394,6218,170270201,120,tt2302755,en,"When the White House (Secret Service Code: ""Olympus"") is captured by a terrorist mastermind and the President is kidnapped, disgraced former Presidential guard Mike Banning finds himself trapped within the building. As the national security team scrambles to respond, they are forced to rely on Banning's inside knowledge to help retake the White House, save the President and avert an even bigger disaster.",41.289,"Action, Thriller","English, Korean","usa president, washington dc, usa, the white house, secret service, terrorist attack, north korea"
615457,Nobody,8.018,6217,61779301,92,tt7888964,en,"Hutch Mansell, a suburban dad, overlooked husband, nothing neighbor — a ""nobody."" When two thieves break into his home one night, Hutch's unknown long-simmering rage is ignited and propels him on a brutal path that will uncover dark secrets he fought to leave behind.",44.03,"Action, Crime, Thriller","English, Russian, Spanish","assassin, double life, midlife crisis, bratva (russian mafia), secret organization, thief, home invasion, family, duringcreditsstinger"
114150,Pitch Perfect,7.295,6206,115400000,112,tt1981677,en,"College student Beca knows she does not want to be part of a clique, but that's exactly where she finds herself after arriving at her new school. Thrust in among mean gals, nice gals and just plain weird gals, Beca finds that the only thing they have in common is how well they sing together. She takes the women of the group out of their comfort zone of traditional arrangements and into a world of amazing harmonic combinations in a fight to the top of college music competitions.",25.464,"Comedy, Music, Romance",English,"competition, roommate, college, female friendship, misfit, hazing, university, audition, group of friends, dorm room, bickering, dj, singing competition, film score, young adult, acapella, music movie"
82700,After Earth,5.191,6205,243843127,100,tt1815862,en,"One thousand years after cataclysmic events forced humanity's escape from Earth, Nova Prime has become mankind's new home. Legendary General Cypher Raige returns from an extended tour of duty to his estranged family, ready to be a father to his 13-year-old son, Kitai. When an asteroid storm damages Cypher and Kitai's craft, they crash-land on a now unfamiliar and dangerous Earth. As his father lies dying in the cockpit, Kitai must trek across the hostile terrain to recover their rescue beacon. His whole life, Kitai has wanted nothing more than to be a soldier like his father. Today, he gets his chance.",24.446,"Science Fiction, Action, Adventure",English,dystopia
398978,The Irishman,7.615,6203,968853,209,tt1302006,en,"Pennsylvania, 1956. Frank Sheeran, a war veteran of Irish origin who works as a truck driver, accidentally meets mobster Russell Bufalino. Once Frank becomes his trusted man, Bufalino sends him to Chicago with the task of helping Jimmy Hoffa, a powerful union leader related to organized crime, with whom Frank will maintain a close friendship for nearly twenty years.",23.095,"Crime, Drama, History","English, Italian, Latin, Spanish","chicago, illinois, philadelphia, pennsylvania, based on novel or book, hitman, pennsylvania, usa, gangster, 1970s, irish-american, male friendship, aging, family relationships, murder, organized crime, mafia, religion, sicilian mafia, nonlinear timeline, labor union, 1950s, 1960s, mob family, jimmy hoffa, voiceover, father daughter relationship, criminal as protagonist, killer as protagonist"
82675,Taken 2,6.3,6201,376141306,91,tt1397280,en,"In Istanbul, retired CIA operative Bryan Mills and his wife are taken hostage by the father of a kidnapper Mills killed while rescuing his daughter.",47.042,"Action, Crime, Thriller","English, Turkish, Arabic","kidnapping, fbi, turkey, police chase, teenage daughter, stealing a car, ex-husband ex-wife relationship, albanian, u.s. embassy"
37686,Super 8,6.76,6199,260095986,112,tt1650062,en,"In 1979 Ohio, several youngsters are making a zombie movie with a Super-8 camera. In the midst of filming, the friends witness a horrifying train derailment and are lucky to escape with their lives. They soon discover that the catastrophe was no accident, as a series of unexplained events and disappearances soon follows. Deputy Jackson Lamb, the father of one of the kids, searches for the terrifying truth behind the crash.",19.534,"Thriller, Science Fiction, Mystery",English,"1970s, alien, train crash, firecracker, super 8mm footage, duringcreditsstinger"
334543,Lion,8.083,6199,140312928,118,tt3741834,en,"A five-year-old Indian boy gets lost on the streets of Calcutta, thousands of kilometers from home. He survives many challenges before being adopted by a couple in Australia; 25 years later, he sets out to find his lost family.",20.266,Drama,"Bengali, English, Hindi","australia, based on novel or book, adoption, biography, based on true story, india, missing child, long lost relative, tasmania, street child"
257211,The Intern,7.205,6199,194564672,121,tt2361509,en,"70-year-old widower Ben Whittaker has discovered that retirement isn't all it's cracked up to be. Seizing an opportunity to get back in the game, he becomes a senior intern at an online fashion site, founded and run by Jules Ostin.",27.542,Comedy,English,"new york city, friendship, san francisco, california, office, masseuse, website, tai chi, internet, fish out of water, brooklyn, new york city, business start-up, driver, senior citizen, ceo, father figure, intern, social media, gentleman, woman director, city life, chivalry, retired life, professional woman, internship, e-comm, retailer, elderly widower, online store"
2668,Sleepy Hollow,7.169,6198,206071502,105,tt0162661,en,New York detective Ichabod Crane is sent to Sleepy Hollow to investigate a series of mysterious deaths in which the victims are found beheaded. Locals believe the culprit to be none other than the legendary Headless Horseman.,32.443,"Drama, Fantasy, Thriller, Mystery, Horror",English,"small town, steampunk, 19th century, headless horseman"
46195,Rio,6.719,6195,484635760,96,tt1436562,en,"Captured by smugglers when he was just a hatchling, a macaw named Blu never learned to fly and lives a happily domesticated life in Minnesota with his human friend, Linda. Blu is thought to be the last of his kind, but when word comes that Jewel, a lone female, lives in Rio de Janeiro, Blu and Linda go to meet her. Animal smugglers kidnap Blu and Jewel, but the pair soon escape and begin a perilous adventure back to freedom -- and Linda.",43.578,"Animation, Adventure, Comedy, Family","English, Portuguese","rio de janeiro, pet, carnival, parrot, musical, canary, jungle, samba, animal, duringcreditsstinger, pets, cartoon bird, brazilian cinema"
18240,The Proposal,7.13,6189,317375031,108,tt1041829,en,"When she learns she's in danger of losing her visa status and being deported, overbearing book editor Margaret Tate forces her put-upon assistant, Andrew Paxton, to marry her.",34.566,"Comedy, Romance, Drama",English,"fictitious marriage, deportation, immigration law, romantic comedy, alaska, co-workers relationship, humiliation, book editor, fake boyfriend, valentine's day, duringcreditsstinger, woman director, pretend relationship"
956,Mission: Impossible III,6.722,6186,398479497,126,tt0317919,en,"Retired from active duty, and training recruits for the Impossible Mission Force, agent Ethan Hunt faces the toughest foe of his career: Owen Davian, an international broker of arms and information, who is as cunning as he is ruthless. Davian emerges to threaten Hunt and all that he holds dear -- including the woman Hunt loves.",45.484,"Adventure, Action, Thriller","German, English, Italian, Mandarin, Czech, Cantonese","mask, mission, berlin, germany, cia, computer, the white house, shanghai, china, funeral, explosive, secret mission, spy, vatican, secret identity, traitor, map, honeymoon, pretended murder, letter, covered investigation, secret agent, stamp, hard drive, e-mail, decipherment, suitcase, revenge, murder, hospital, duel, disguise, celebration, research laboratory, blast"
530385,Midsommar,7.162,6185,47969371,147,tt8772262,en,"Several friends travel to Sweden to study as anthropologists a summer festival that is held every ninety years in the remote hometown of one of them. What begins as a dream vacation in a place where the sun never sets, gradually turns into a dark nightmare as the mysterious inhabitants invite them to participate in their disturbing festive activities.",32.581,"Horror, Drama, Mystery","English, Swedish","ritual, paranoia, sweden, melancholy, cult, hallucinogenic drug, magic mushroom, anthropology, human sacrifice, paganism, death of family, macabre, boyfriend girlfriend relationship, midsummer, cultural conflict, mysterious, bad trip, folk horror, toxic relationship, midnight sun, isolated community, summer festival, traumatized woman, introspective, violence, ambiguous"
4232,Scream,7.4,6180,173046663,112,tt0117571,en,"A year after the murder of her mother, Sidney Prescott is terrorized by a masked killer who targets her and her friends by using scary movies as part of a deadly game.",61.423,"Crime, Horror, Mystery",English,"high school, small town, riddle, killing, halloween, house party, serial killer, school, slasher, whodunit, killing spree, phone, tabloid, news reporter, self-referential, crime spree, halloween costume, young adult, teenager"
419704,Ad Astra,6.1,6143,127461872,123,tt2935510,en,"The near future, a time when both hope and hardships drive humanity to look to the stars and beyond. While a mysterious phenomenon menaces to destroy life on planet Earth, astronaut Roy McBride undertakes a mission across the immensity of space and its many perils to uncover the truth about a lost expedition that decades before boldly faced emptiness and silence in search of the unknown.",11.084,"Science Fiction, Drama","English, Norwegian","moon, planet mars, loss of loved one, astronaut, moon colony, solar system, father son relationship, near future, planet neptune, space walk"
955,Mission: Impossible II,6.119,6122,546388105,123,tt0120755,en,"With computer genius Luther Stickell at his side and a beautiful thief on his mind, agent Ethan Hunt races across Australia and Spain to stop a former IMF agent from unleashing a genetically engineered biological weapon called Chimera. This mission, should Hunt choose to accept it, plunges him into the center of an international crisis of terrifying magnitude.",38.395,"Adventure, Action, Thriller",English,"dying and death, island, cia, helicopter, computer, spain, undercover, skyscraper, secret mission, spy, secret identity, ex-lover, secret agent, duel, lethal virus, rescue team, agent, research laboratory"
4011,Beetlejuice,7.384,6117,74714298,92,tt0094721,en,"After an untimely death, a newly dead New England couple seek help from a deranged demon exorcist to scare an affluent New York family out of their home.",41.633,"Fantasy, Comedy",English,"skeleton, afterlife, calypso, supernatural, arts, halloween, haunted house, minister, possession, giant snake, surrealism, child bride, teenage girl, gothic, death, madness, dead, ghost, property"
11688,The Emperor's New Groove,7.551,6109,169327687,78,tt0120917,en,"Kuzco is a self-centered emperor who summons Pacha from a village and to tell him that his home will be destroyed to make room for Kuzco's new summer home. Kuzco's advisor, Yzma, tries to poison Kuzco and accidentally turns him into a llama, who accidentally ends up in Pacha's village. Pacha offers to help Kuzco if he doesn't destroy his house, and so they form an unlikely partnership.",76.823,"Adventure, Animation, Comedy, Family, Fantasy",English,"central and south america, kingdom, birthday, peru, emperor, palace, berater, breaking the fourth wall, incan empire, assassination attempt, 15th century, llama"
170,28 Days Later,7.202,6104,85720385,113,tt0289043,en,"Twenty-eight days after a killer virus was accidentally unleashed from a British research facility, a small group of London survivors are caught in a desperate struggle to protect themselves from the infected. Carried by animals and humans, the virus turns those it infects into homicidal maniacs -- and it's absolutely impossible to contain.",37.355,"Horror, Thriller, Science Fiction","Spanish, English","daughter, taxi, london, england, submachine gun, gas station, infection, outbreak, survival, laboratory, hospital, zombie, brutality, church, rage, epidemic, military, virus, waking from coma, animal research, brutal violence"
296,Terminator 3: Rise of the Machines,6.145,6098,435000000,109,tt0181852,en,"It's been 10 years since John Connor saved Earth from Judgment Day, and he's now living under the radar, steering clear of using anything Skynet can trace. That is, until he encounters T-X, a robotic assassin ordered to finish what T-1000 started. Good thing Connor's former nemesis, the Terminator, is back to aid the now-adult Connor … just like he promised.",36.434,"Action, Thriller, Science Fiction",English,"man vs machine, artificial intelligence (a.i.), saving the world, leather jacket, cyborg, killer robot, dystopia, nanotechnology, rocket launcher, veterinarian, fire engine, villain, time travel, psychiatrist, urban setting, female villain, firefighter, action hero, 2030s, good versus evil, terminator"
293863,The Age of Adaline,7.469,6092,65663276,112,tt1655441,en,"After 29-year-old Adaline recovers from a nearly lethal accident, she inexplicably stops growing older. As the years stretch on and on, Adaline keeps her secret to herself  until she meets a man who changes her life.",27.069,"Romance, Fantasy, Drama",English,"immortality, san francisco, california, love, forever"
3131,Gangs of New York,7.318,6091,193772504,168,tt0217505,en,"In 1863, Amsterdam Vallon returns to the Five Points of America to seek vengeance against the psychotic gangland kingpin, Bill the Butcher, who murdered his father years earlier. With an eager pickpocket by his side and a whole new army, Vallon fights his way to seek vengeance on the Butcher and restore peace in the area.",31.711,"Drama, History, Crime","English, Irish, Latin, Mandarin","rescue, immigrant, ship, fire, army, pickpocket, pig, irish-american, gang war, gang of thieves, butcher, gang, 19th century, american history"
439079,The Nun,5.9,6076,365582797,96,tt5814060,en,A priest with a haunted past and a novice on the threshold of her final vows are sent by the Vatican to investigate the death of a young nun in Romania and confront a malevolent force in the form of a demonic nun.,357.731,"Horror, Mystery, Thriller","English, Romanian, French, Latin","rome, italy, nun, supernatural, exorcism, father, priest, spirit, demon, spin off, evil nun, demonic possession, romania, murder mystery, ancient evil, the conjuring universe"
100,"Lock, Stock and Two Smoking Barrels",8.126,6072,28356188,105,tt0120735,en,A card shark and his unwillingly-enlisted friends need to make a lot of cash quick after losing a sketchy poker match. To do this they decide to pull a heist on a small-time gang who happen to be operating out of the flat next door.,10.5,"Comedy, Crime",English,"ambush, joint, alcohol, shotgun, tea, machismo, rifle, cocktail, pot smoking, marijuana, hatchet, antique, cardsharp, anger, carjacking, piano, strip show, high stakes"
53182,300: Rise of an Empire,6.093,6055,337580051,102,tt1253863,en,"Greek general Themistocles attempts to unite all of Greece by leading the charge that will change the course of the war. Themistocles faces the massive invading Persian forces led by mortal-turned-god, Xerxes and Artemesia, the vengeful commander of the Persian navy.",38.678,"Action, Drama, War",English,"based on comic, sword fight, soldier, massacre, slow motion, based on graphic novel, ancient greece, duringcreditsstinger, sea battle, hand to hand combat, naval warfare, ancient warfare, sparta greece, warriors, 5th century bc, athenian, sword and sandal, god king, sword and shield"
47964,A Good Day to Die Hard,5.3,6052,304654182,98,tt1606378,en,"Iconoclastic, take-no-prisoners cop John McClane, finds himself for the first time on foreign soil after traveling to Moscow to help his wayward son Jack - unaware that Jack is really a highly-trained CIA operative out to stop a nuclear weapons heist. With the Russian underworld in pursuit, and battling a countdown to war, the two McClanes discover that their opposing methods make them unstoppable heroes.",88.883,"Action, Thriller","English, Russian","cia, escape, bomb, courthouse, agent, rogue, moscow, russia"
508,Love Actually,7.1,6047,244931766,135,tt0314331,en,Eight London couples try to deal with their relationships in different ways. Their tryst with love makes them discover how complicated relationships can be.,23.456,"Comedy, Romance, Drama","English, French, Portuguese","london, england, usa president, rock star, school performance, love at first sight, holiday, war on terror, marseille, france, office, christmas party, language barrier, prime minister, press conference, bars and restaurants, valentine's day, heathrow airport, multiple storylines, christmas"
238636,The Purge: Anarchy,6.649,6042,111928365,104,tt2975578,en,"One night per year, the government sanctions a 12-hour period in which citizens can commit any crime they wish -- including murder -- without fear of punishment or imprisonment. Leo, a sergeant who lost his son, plans a vigilante mission of revenge during the mayhem. However, instead of a death-dealing avenger, he becomes the unexpected protector of four innocent strangers who desperately need his help if they are to survive the night.",36.694,"Horror, Thriller",English,"sniper, psychopath, bus, assault rifle, machete, sequel, revenge, murder, rampage, motorcycle, masked man, death, survival horror, martyr, gatling gun, purge"
