id,title,vote_average,vote_count,revenue,runtime,imdb_id,original_language,overview,popularity,genres,spoken_languages,keywords
126889,Alien: Covenant,6.1,7822,240891763,122,tt2316204,en,"Bound for a remote planet on the far side of the galaxy, the crew of the colony ship 'Covenant' discovers what is thought to be an uncharted paradise, but is actually a dark, dangerous world—which has a sole inhabitant: the 'synthetic', David, survivor of the doomed Prometheus expedition.",92.533,"Science Fiction, Horror, Mystery","English, German","android, spacecraft, experiment, space travel, infection, engineer, alien life-form, sequel, alien, space, creature, robot, scientist, genocide, creation, acid, xenomorph, alien technology, genetic mutation"
450465,Glass,6.677,7793,246999039,129,tt6823368,en,"In a series of escalating encounters, former security guard David Dunn uses his supernatural abilities to track Kevin Wendell Crumb, a disturbed man who has twenty-four personalities. Meanwhile, the shadowy presence of Elijah Price emerges as an orchestrator who holds secrets critical to both men.",31.843,"Thriller, Drama, Science Fiction","English, Spanish","superhero, villain, sequel, psychiatric hospital, comic book shop, super power, mental illness, multiple personality, dissociative identity disorder, surveillance specialist"
670,Oldboy,8.274,7790,15194593,120,tt0364569,ko,"With no clue how he came to be imprisoned, drugged and tortured for 15 years, a desperate businessman seeks revenge on his captors.",53.128,"Drama, Thriller, Mystery, Action",Korean,"daughter, rage and hate, hostility, transformation, imprisonment, dark comedy, hypnosis, sushi restaurant, notebook, time, sin, alcoholism, flashback, revenge, loneliness, torture, based on manga, urination, rage, anger, catholic, incest, hopeless, captivity, neo-noir, father daughter relationship, asian origins, remade, south korea, hammer, driven to suicide, audacious, pessimistic"
537915,After,7.137,7781,69497587,106,tt4126476,en,"Tessa Young is a dedicated student, dutiful daughter and loyal girlfriend to her high school sweetheart. Entering her first semester of college, Tessa's guarded world opens up when she meets Hardin Scott, a mysterious and brooding rebel who makes her question all she thought she knew about herself -- and what she wants out of life.",155.287,"Romance, Drama",English,"based on novel or book, love, teenage crush"
122906,About Time,7.905,7781,87100449,123,tt2194499,en,"The night after another unsatisfactory New Year's party, Tim's father tells his son that the men in his family have always had the ability to travel through time. They can't change history, but they can change what happens and has happened in their own lives. Thus begins the start of a lesson in learning to appreciate life itself as it is, as it comes, and most importantly, the people living alongside us.",35.707,"Drama, Romance, Fantasy",English,"london, england, parent child relationship, time travel, family secrets, cornwall, england, love, family, second chance, time-manipulation, celebratory"
402900,Ocean's Eight,6.985,7780,297718711,111,tt5164214,en,"Debbie Ocean, a criminal mastermind, gathers a crew of female thieves to pull off the heist of the century at New York's annual Met Gala.",30.268,"Crime, Comedy, Action","English, German","new york city, heist, spin off, estranged sister, the met gala"
50646,"Crazy, Stupid, Love.",7.3,7773,145079584,118,tt1570728,en,"Cal Weaver is living the American dream. He has a good job, a beautiful house, great children and a beautiful wife, named Emily. Cal's seemingly perfect life unravels, however, when he learns that Emily has been unfaithful and wants a divorce. Over 40 and suddenly single, Cal is adrift in the fickle world of dating. Enter, Jacob Palmer, a self-styled player who takes Cal under his wing and teaches him how to be a hit with the ladies.",39.835,"Comedy, Drama, Romance",English,"friendship, soulmates, marriage crisis, midlife crisis, babysitter, womanizer, law school, los angeles, california, middle school, relationship, love affair, divorcee, teenage love"
259693,The Conjuring 2,7.293,7769,321834351,134,tt3065204,en,Lorraine and Ed Warren travel to north London to help a single mother raising four children alone in a house plagued by malicious spirits.,80.98,"Horror, Thriller",English,"london, england, england, 1970s, spirit, single mother, demon, paranormal investigation, demonic possession, ghost, christmas, valak, the conjuring universe"
314365,Spotlight,7.814,7765,98690254,129,tt1895587,en,"The true story of how the Boston Globe uncovered the massive scandal of child molestation and cover-up within the local Catholic Archdiocese, shaking the entire Catholic Church to its core.",20.159,"Drama, History",English,"pedophilia, florida, newspaper, journalist, child abuse, court, judge, boston, massachusetts, journalism, sex scandal, victim, based on true story, cover-up, priest, conspiracy, lawyer, historical fiction, catholic, catholic church, lgbt, catholicism, 9/11, child molestation, archdiocese, investigative journalism, cardinal"
747,Shaun of the Dead,7.54,7760,30097092,99,tt0365748,en,"Shaun lives a supremely uneventful life, which revolves around his girlfriend, his mother, and, above all, his local pub. This gentle routine is threatened when the dead return to life and make strenuous attempts to snack on ordinary Londoners.",46.212,"Horror, Comedy",English,"london, england, dark comedy, satire, surrey, parody, slacker, friends, survival, zombie, survival horror, british pub, boyfriend girlfriend relationship, zombie apocalypse"
429,"The Good, the Bad and the Ugly",8.473,7751,38900000,161,tt0060196,it,"While the Civil War rages on between the Union and the Confederacy, three men – a quiet loner, a ruthless hitman, and a Mexican bandit – comb the American Southwest in search of a strongbox containing $200,000 in stolen gold.",81.717,Western,Italian,"gold, army, bounty hunter, hitman, refugee, anti hero, moral ambiguity, gallows, outlaw, shootout, spaghetti western, american civil war, dollars trilogy"
68734,Argo,7.275,7750,232325503,120,tt1024648,en,"As the Iranian revolution reaches a boiling point, a CIA 'exfiltration' specialist concocts a risky plan to free six Americans who have found shelter at the home of the Canadian ambassador.",17.552,"Drama, Thriller","Arabic, English, German, Persian","cia, husband wife relationship, revolution, press conference, biography, american abroad, extraction, iran hostage crisis, intelligence agent, langley virginia, 1980s, political thriller"
330,The Lost World: Jurassic Park,6.527,7740,618638999,129,tt0119567,en,"Four years after Jurassic Park's genetically bred dinosaurs ran amok, multimillionaire John Hammond shocks chaos theorist Ian Malcolm by revealing that he has been breeding more beasties at a secret location. Malcolm, his paleontologist ladylove and a wildlife videographer join an expedition to document the lethal lizards' natural behavior in this action-packed thriller.",2.257,"Adventure, Action, Science Fiction",English,"exotic island, island, velociraptor, dna, tyrannosaurus rex, paleontology, san diego, california, dinosaur, creature, scientist, amusement park, theme park, costa rica, animal horror, father daughter relationship"
38356,Transformers: Dark of the Moon,6.183,7736,1123794079,154,tt1399103,en,"The Autobots continue to work for NEST, now no longer in secret. But after discovering a strange artifact during a mission in Chernobyl, it becomes apparent to Optimus Prime that the United States government has been less than forthright with them.",10.499,"Action, Science Fiction, Adventure",English,"spacecraft, moon, traitor, bodyguard, alien planet, based on toy, giant robot, sabotage, word domination, commando, duringcreditsstinger"
74,War of the Worlds,6.496,7728,603873119,117,tt0407304,en,"Ray Ferrier is a divorced dockworker and less-than-perfect father. Soon after his ex-wife and her new husband drop off his teenage son and young daughter for a rare weekend visit, a strange and powerful lightning storm touches down.",40.932,"Adventure, Thriller, Science Fiction",English,"daughter, new jersey, post-traumatic stress disorder (ptsd), airplane, based on novel or book, underground, dystopia, alien, remake, survival, disaster, apocalypse, creature, alien invasion, human subjugation"
744,Top Gun,7.0,7710,356830601,110,tt0092099,en,"For Lieutenant Pete 'Maverick' Mitchell and his friend and co-pilot Nick 'Goose' Bradshaw, being accepted into an elite training school for fighter pilots is a dream come true. But a tragedy, as well as personal demons, will threaten Pete's dreams of becoming an ace pilot.",50.029,"Romance, Drama, Action",English,"dying and death, secret love, lovesickness, airplane, loss of loved one, self-discovery, hostility, fighter pilot, pilot, training camp, battle assignment, u.s. navy, cowardliness, pilot school, based on magazine, newspaper or article"
45612,Source Code,7.297,7694,147332697,94,tt0945513,en,"When decorated soldier Captain Colter Stevens wakes up in the body of an unknown man, he discovers he's part of a mission to find the bomber of a Chicago commuter train.",31.922,"Thriller, Science Fiction, Mystery",English,"race against time, bomb, virtual reality, identity, investigation, bomber, suspicion, surrealism, time loop, soldier, helicopter pilot, augmented reality"
436969,The Suicide Squad,7.557,7692,168717425,132,tt6334354,en,"Supervillains Harley Quinn, Bloodsport, Peacemaker and a collection of nutty cons at Belle Reve prison join the super-secret, super-shady Task Force X as they are dropped off at the remote, enemy-infused island of Corto Maltese.",63.194,"Action, Comedy, Adventure","English, French, Spanish","monster, secret mission, superhero, anti hero, giant monster, gore, based on comic, alien, betrayal, alien invasion, convict, parasite, super villain, world domination, aftercreditsstinger, dc extended universe (dceu), muscular men, character deaths"
8355,Ice Age: Dawn of the Dinosaurs,6.737,7680,886686817,94,tt1080016,en,"Times are changing for Manny the moody mammoth, Sid the motor mouthed sloth and Diego the crafty saber-toothed tiger. Life heats up for our heroes when they meet some new and none-too-friendly neighbors – the mighty dinosaurs.",57.649,"Animation, Comedy, Family, Adventure",English,"insanity, ice age, bridge, sequel, jungle, prehistory, dinosaur, creature, birth, duringcreditsstinger"
63,Twelve Monkeys,7.6,7677,168841459,129,tt0114746,en,"In the year 2035, convict James Cole reluctantly volunteers to be sent back in time to discover the origin of a deadly virus that wiped out nearly all of the earth's population and forced the survivors into underground communities. But when Cole is mistakenly sent to 1990 instead of 1996, he's arrested and locked up in a mental hospital. There he meets psychiatrist Dr. Kathryn Railly, and patient Jeffrey Goines, the son of a famous virus expert, who may hold the key to the mysterious rogue group, the Army of the 12 Monkeys, thought to be responsible for unleashing the killer disease.",33.942,"Science Fiction, Thriller, Mystery","English, French","biological weapon, philadelphia, pennsylvania, schizophrenia, stockholm syndrome, airplane, underground, insanity, asylum, paranoia, prison cell, dystopia, pimp, lion, post-apocalyptic future, time travel, florida keys, mental breakdown, past, dormitory, insane asylum, cockroach, volunteer, drug use, flashback, remake, psychiatric hospital, jail, mental institution, alternate history, disease, lethal virus, paradox, psychiatrist, monkey, epidemic, trapped, falling down stairs, street life, nonlinear timeline, medical research, tooth, pantyhose, gas mask, psychosis, child's point of view, subterranean, virus, recurring dream, 1990s, escaped animal, future noir, 2030s, cassandra syndrome, bullet, endless loop, stream, vivisection, nude pantyhose, microbiologist, real movie shown in fictional situation, kick in face, eating spider, reference to houdini, abandoned theater, tied to a bed, psychiatric care, hiding in a barn, reference to cassandra, biblical quote, person in a car trunk, watching a movie, world war one, lab animal, cassandra complex"
278927,The Jungle Book,6.86,7668,966550600,106,tt3040964,en,"A man-cub named Mowgli fostered by wolves. After a threat from the tiger Shere Khan, Mowgli is forced to flee the jungle, by which he embarks on a journey of self discovery with the help of the panther, Bagheera and the free-spirited bear, Baloo.",33.274,"Family, Adventure, Drama, Fantasy",English,"based on novel or book, snake, elephant, wolf, tiger, feral child, anthropomorphism, remake, jungle, bear, orphan, ape, monkey, animal, talking to animals, live action and animation, live action remake"
328111,The Secret Life of Pets,6.266,7664,875457937,86,tt2709768,en,"The quiet life of a terrier named Max is upended when his owner takes in Duke, a stray whom Max instantly dislikes.",13.019,"Adventure, Comedy, Animation, Family",English,"bunny, pet, anthropomorphism, dog, animal, apartment building, sewer, terrier, manhattan, new york city, rodent, pets, mongrel, illumination"
550988,Free Guy,7.55,7662,331526598,115,tt6264654,en,"A bank teller discovers he is actually a background player in an open-world video game, and decides to become the hero of his own story. Now, in a world where there are no limits, he is determined to be the guy who saves his world his way before it's too late.",62.599,"Comedy, Adventure, Science Fiction","Japanese, English","hero, artificial intelligence (a.i.), video game, virtual reality, gun, code, gamer, bank robbery, bank teller, programmer, mmorpg, heroic"
389,12 Angry Men,8.54,7658,1000000,97,tt0050083,en,"The defense and the prosecution have rested and the jury is filing into the jury room to decide if a young Spanish-American is guilty or innocent of murdering his father. What begins as an open and shut case soon becomes a mini-drama of each of the jurors' prejudices and preconceptions about the trial, the accused, and each other.",51.201,Drama,English,"death penalty, anonymity, court case, court, judge, jurors, father murder, class, sultriness, heat, innocence, puerto rico, based on play or musical, courtroom, courtroom drama, one location"
217,Indiana Jones and the Kingdom of the Crystal Skull,5.998,7629,786636033,122,tt0367882,en,"Set during the Cold War, the Soviets—led by sword-wielding Irina Spalko—are in search of a crystal skull which has supernatural powers related to a mystical Lost City of Gold. Indy is coerced to head to Peru at the behest of a young man whose friend—and Indy's colleague—Professor Oxley has been captured for his knowledge of the skull's whereabouts.",47.907,"Adventure, Action","English, German, Russian","treasure, mexico city, mexico, saving the world, whip, leather jacket, riddle, maya civilization, peru, machinegun, treasure hunt, alien, nuclear explosion, refrigerator, archaeologist, adventurer, area 51, archeology, 1950s, father son relationship"
508943,Luca,7.865,7625,49750471,95,tt12801262,en,Luca and his best friend Alberto experience an unforgettable summer on the Italian Riviera. But all the fun is threatened by a deeply-held secret: they are sea monsters from another world just below the water’s surface.,60.762,"Animation, Comedy, Fantasy, Adventure, Family","English, Italian","friendship, monster, italy, coming of age, friends, bromance, sea monster, vespa, aftercreditsstinger, seaside town, 1950s, pasta, water, italian riviera, pesto"
91314,Transformers: Age of Extinction,5.92,7581,1104054072,165,tt2109248,en,"As humanity picks up the pieces, following the conclusion of ""Transformers: Dark of the Moon,"" Autobots and Decepticons have all but vanished from the face of the planet. However, a group of powerful, ingenious businessman and scientists attempt to learn from past Transformer incursions and push the boundaries of technology beyond what they can control - all while an ancient, powerful Transformer menace sets Earth in his cross-hairs.",57.581,"Science Fiction, Action, Adventure",English,"music video, sequel, alien, based on toy, giant robot, robot, transformers"
51497,Fast Five,7.251,7581,626137675,130,tt1596343,en,"Former cop Brian O'Conner partners with ex-con Dom Toretto on the opposite side of the law. Since Brian and Mia Toretto broke Dom out of custody, they've blown across many borders to elude authorities. Now backed into a corner in Rio de Janeiro, they must pull one last job in order to gain their freedom.",8.589,"Action, Thriller, Crime","English, Spanish, Portuguese, Italian","car race, freedom, fbi, car crash, prison escape, heist, escaped convict, street race, money, organized crime, fugitive, on the run, police chase, duringcreditsstinger"
315837,Ghost in the Shell,6.066,7581,169801921,107,tt1219827,en,"In the near future, Major is the first of her kind: a human saved from a terrible crash, then cyber-enhanced to be a perfect soldier devoted to stopping the world's most dangerous criminals.",32.851,"Science Fiction, Drama, Action","Japanese, English","strong woman, hacker, philosophy, cyborg, dystopia, investigation, female protagonist, cyberpunk, terrorism, based on manga, evolution, network, based on anime, prosthesis, anxious"
39254,Real Steel,6.981,7571,299268508,127,tt0433035,en,"Charlie Kenton is a washed-up fighter who retired from the ring when robots took over the sport. After his robot is trashed, he reluctantly teams up with his estranged son to rebuild and train an unlikely contender.",88.181,"Action, Science Fiction, Drama",English,"future, sports, parent child relationship, fight, robot, prizefight, father son reunion, robot fighting"
38700,Bad Boys for Life,7.139,7570,426505244,124,tt1502397,en,"Marcus and Mike are forced to confront new threats, career changes, and midlife crises as they join the newly created elite team AMMO of the Miami police department to take down the ruthless Armando Armas, the vicious leader of a Miami drug cartel.",46.619,"Thriller, Action, Crime","English, Spanish","miami, florida, detective, women's prison, sequel, prison escape, murder, drug cartel, police chase, police detective, buddy cop, buddy film, action hero, past relationship, méxico"
361743,Top Gun: Maverick,8.26,7546,1488732821,131,tt1745960,en,"After more than thirty years of service as one of the Navy’s top aviators, and dodging the advancement in rank that would ground him, Pete “Maverick” Mitchell finds himself training a detachment of TOP GUN graduates for a specialized mission the likes of which no living pilot has ever seen.",126.291,"Action, Drama",English,"fighter pilot, u.s. navy, sequel, nuclear weapons, military"
339846,Baywatch,6.092,7545,177856751,116,tt1469304,en,"Devoted lifeguard Mitch Buchannon butts heads with a brash new recruit. Together, they uncover a local criminal plot that threatens the future of the Bay.",45.123,"Comedy, Action, Crime",English,"drug dealer, sea, beach, yacht, life-saver, lifeguard, rookie, vigilantism"
187,Sin City,7.4,7541,158733820,124,tt0401792,en,"Welcome to Sin City. This town beckons to the tough, the corrupt, the brokenhearted. Some call it dark… Hard-boiled. Then there are those who call it home — Crooked cops, sexy dames, desperate vigilantes. Some are seeking revenge, others lust after redemption, and then there are those hoping for a little of both. A universe of unlikely and reluctant heroes still trying to do the right thing in a city that refuses to care.",42.369,"Thriller, Action, Crime",English,"dystopia, based on comic, anthology, held captive, based on graphic novel, mysterious killer, doing the right thing, silhouette, neo-noir"
50014,The Help,8.202,7538,216639112,146,tt1454029,en,"Aibileen Clark is a middle-aged African-American maid who has spent her life raising white children and has recently lost her only son; Minny Jackson is an African-American maid who has often offended her employers despite her family's struggles with money and her desperate need for jobs; and Eugenia ""Skeeter"" Phelan is a young white woman who has recently moved back home after graduating college to find out her childhood maid has mysteriously disappeared. These three stories intertwine to explain how life in Jackson, Mississippi revolves around ""the help""; yet they are always kept at a certain distance because of racial lines.",52.139,Drama,English,"based on novel or book, mississippi river, exploitation, racial segregation, racism, writer, maid, moral courage, ressentiment, southern belle, racial issues, 1960s, newspaper columnist"
353081,Mission: Impossible - Fallout,7.414,7537,791657398,147,tt4912910,en,"When an IMF mission ends badly, the world is faced with dire consequences. As Ethan Hunt takes it upon himself to fulfill his original briefing, the CIA begin to question his loyalty and his motives. The IMF team find themselves in a race against time, hunted by assassins while trying to prevent a global catastrophe.",61.258,"Action, Adventure","English, French","race against time, london, england, helicopter, paris, france, plutonium, gun, spy, countdown, norway, sequel, motorcycle, bomb remote detonator, handgun, hand to hand combat, kashmir"
337167,Fifty Shades Freed,6.705,7511,368307760,105,tt4477536,en,"Believing they have left behind shadowy figures from their past, newlyweds Christian and Ana fully embrace an inextricable connection and shared life of luxury. But just as she steps into her role as Mrs. Grey and he relaxes into an unfamiliar stability, new threats could jeopardize their happy ending before it even begins.",93.385,"Drama, Romance",English,"based on novel or book, eroticism, sequel, bdsm"
58595,Snow White and the Huntsman,5.982,7503,396600000,127,tt1735898,en,"After the Evil Queen marries the King, she performs a violent coup in which the King is murdered and his daughter, Snow White, is taken captive. Almost a decade later, a grown Snow White is still in the clutches of the Queen. In order to obtain immortality, The Evil Queen needs the heart of Snow White. After Snow escapes the castle, the Queen sends the Huntsman to find her in the Dark Forest.",34.976,"Adventure, Fantasy, Drama",English,"magic, immortality, fairy tale, queen, imprisonment, forest, deception, eternal youth, evil queen, evil stepmother, based on fairy tale, sorceress, live action remake"
524434,Eternals,6.927,7493,402064899,156,tt9032400,en,"The Eternals are a team of ancient aliens who have been living on Earth in secret for thousands of years. When an unexpected tragedy forces them out of the shadows, they are forced to reunite against mankind’s most ancient enemy, the Deviants.",60.521,"Science Fiction, Action, Adventure","Arabic, English, Hindi, Latin, Spanish","superhero, supernatural, based on comic, alien, super power, aftercreditsstinger, marvel cinematic universe (mcu), sign languages, ancient, god-like"
28,Apocalypse Now,8.282,7485,150000000,147,tt0078788,en,"At the height of the Vietnam war, Captain Benjamin Willard is sent on a dangerous mission that, officially, ""does not exist, nor will it ever exist."" His goal is to locate - and eliminate - a mysterious Green Beret Colonel named Walter Kurtz, who has been leading his personal army on illegal guerrilla missions into enemy territory.",37.715,"Drama, War","Khmer, English, French, Vietnamese","guerrilla warfare, epic, vietnam war, journalist, mission, vietnam, vietcong, cia, cambodia, army, drug abuse, based on novel or book, secret mission, insanity, surrealism, tribe, green beret, jungle, descent into madness, brutality, riverboat, military, anti war"
2108,The Breakfast Club,7.751,7478,51525171,98,tt0088847,en,"Five high school students from different walks of life endure a Saturday detention under a power-hungry principal. The disparate group includes rebel John, princess Claire, outcast Allison, brainy Brian and Andrew, the jock. Each has a chance to tell his or her story, making the others see them a little differently -- and when the day ends, they question whether school will ever be the same.",27.667,"Comedy, Drama",English,"high school, coming of age, teen angst, detention, teenage rebellion, stereotype, 1980s, one location, teenager"
187017,22 Jump Street,6.842,7460,331333876,112,tt2294449,en,"After making their way through high school (twice), big changes are in store for officers Schmidt and Jenko when they go deep undercover at a local college. But when Jenko meets a kindred spirit on the football team, and Schmidt infiltrates the bohemian art major scene, they begin to question their partnership. Now they don't have to just crack the case - they have to figure out if they can have a mature relationship. If these two overgrown adolescents can grow from freshmen into real men, college might be the best thing that ever happened to them.",23.367,"Crime, Comedy, Action",English,"high school, undercover cop, buddy cop, buddy comedy, aftercreditsstinger, duringcreditsstinger"
335797,Sing,7.114,7458,634151679,108,tt3470600,en,A koala named Buster recruits his best friend to help him drum up business for his theater by hosting a singing competition.,45.871,"Animation, Comedy, Family, Music",English,"anthropomorphism, singing, singing competition, illumination"
198184,Chappie,6.776,7438,104399548,120,tt1823672,en,"Every child comes into the world full of promise, and none more so than Chappie: he is gifted, special, a prodigy. Like any child, Chappie will come under the influence of his surroundings—some good, some bad—and he will rely on his heart and soul to find his way in the world and become his own man. But there's one thing that makes Chappie different from any one else: he is a robot.",34.709,"Crime, Action, Science Fiction",English,"future, android, artificial intelligence (a.i.), dystopia, johannesburg south africa, robot, robot cop"
